{
  "$schema": "https://json-schema.org/draft/2020-12/schema",
  "title": "Opinión de protección de datos (PrivacyOpinion.json, rol dpo)",
  "type": "object",
  "required": [
    "feature",
    "decisionClass",
    "reserved",
    "summary",
    "options",
    "recommendation",
    "risks",
    "processing",
    "legalBasis",
    "necessityProportionality",
    "risksToSubjects",
    "subjectRights",
    "breachAssessment",
    "opinion",
    "approvalPath",
    "actions"
  ],
  "additionalProperties": false,
  "properties": {
    "feature": {
      "type": "string"
    },
    "decisionClass": {
      "enum": [
        "prioritization",
        "postmortem",
        "change",
        "risk",
        "pir",
        "production",
        "publish",
        "delete",
        "spend",
        "credentials",
        "legal",
        "none"
      ]
    },
    "reserved": {
      "type": "boolean"
    },
    "summary": {
      "type": "string",
      "minLength": 1,
      "maxLength": 1200
    },
    "options": {
      "type": "array",
      "minItems": 1,
      "maxItems": 8,
      "items": {
        "type": "object",
        "required": [
          "id",
          "title",
          "pros",
          "cons"
        ],
        "additionalProperties": false,
        "properties": {
          "id": {
            "type": "string",
            "pattern": "^[A-Za-z0-9._-]{1,20}$"
          },
          "title": {
            "type": "string",
            "minLength": 1,
            "maxLength": 160
          },
          "pros": {
            "type": "array",
            "items": {
              "type": "string",
              "minLength": 1,
              "maxLength": 300
            },
            "maxItems": 10
          },
          "cons": {
            "type": "array",
            "items": {
              "type": "string",
              "minLength": 1,
              "maxLength": 300
            },
            "maxItems": 10
          }
        }
      }
    },
    "recommendation": {
      "type": "object",
      "required": [
        "option",
        "rationale"
      ],
      "additionalProperties": false,
      "properties": {
        "option": {
          "type": "string",
          "pattern": "^[A-Za-z0-9._-]{1,20}$"
        },
        "rationale": {
          "type": "string",
          "minLength": 1,
          "maxLength": 1200
        }
      }
    },
    "risks": {
      "type": "array",
      "maxItems": 20,
      "items": {
        "type": "object",
        "required": [
          "id",
          "description",
          "likelihood",
          "impact",
          "mitigation"
        ],
        "additionalProperties": false,
        "properties": {
          "id": {
            "type": "string",
            "pattern": "^[A-Za-z0-9._-]{1,20}$"
          },
          "description": {
            "type": "string",
            "minLength": 1,
            "maxLength": 400
          },
          "likelihood": {
            "enum": [
              "low",
              "medium",
              "high"
            ]
          },
          "impact": {
            "enum": [
              "low",
              "medium",
              "high"
            ]
          },
          "mitigation": {
            "type": "string",
            "minLength": 1,
            "maxLength": 400
          }
        }
      }
    },
    "processing": {
      "type": "string",
      "minLength": 1,
      "maxLength": 600
    },
    "legalBasis": {
      "type": "string",
      "minLength": 1,
      "maxLength": 300
    },
    "necessityProportionality": {
      "type": "string",
      "minLength": 1,
      "maxLength": 1000
    },
    "risksToSubjects": {
      "type": "array",
      "minItems": 1,
      "maxItems": 30,
      "items": {
        "type": "object",
        "required": [
          "risk",
          "severity",
          "measure"
        ],
        "additionalProperties": false,
        "properties": {
          "risk": {
            "type": "string",
            "minLength": 1,
            "maxLength": 1200
          },
          "severity": {
            "enum": [
              "low",
              "medium",
              "high"
            ]
          },
          "measure": {
            "type": "string",
            "minLength": 1,
            "maxLength": 1200
          }
        }
      }
    },
    "subjectRights": {
      "type": "array",
      "minItems": 0,
      "maxItems": 30,
      "items": {
        "type": "string",
        "minLength": 1,
        "maxLength": 400
      }
    },
    "breachAssessment": {
      "type": "array",
      "minItems": 0,
      "maxItems": 30,
      "items": {
        "type": "object",
        "required": [
          "incident",
          "notifiable",
          "deadline"
        ],
        "additionalProperties": false,
        "properties": {
          "incident": {
            "type": "string",
            "minLength": 1,
            "maxLength": 1200
          },
          "notifiable": {
            "enum": [
              "yes",
              "no",
              "undetermined"
            ]
          },
          "deadline": {
            "type": "string",
            "minLength": 1,
            "maxLength": 1200
          }
        }
      }
    },
    "opinion": {
      "enum": [
        "favorable",
        "favorable-with-measures",
        "unfavorable"
      ]
    },
    "approvalPath": {
      "type": "object",
      "required": [
        "approver",
        "command"
      ],
      "additionalProperties": false,
      "properties": {
        "approver": {
          "type": "string",
          "pattern": "^(agent:[a-z][a-z0-9-]{1,40}|user)$"
        },
        "command": {
          "type": "string",
          "minLength": 1,
          "maxLength": 300
        }
      }
    },
    "actions": {
      "type": "array",
      "maxItems": 20,
      "items": {
        "$ref": "#/$defs/action"
      }
    }
  },
  "$defs": {
    "action": {
      "type": "object",
      "required": [
        "id",
        "title",
        "entryType",
        "owner",
        "due"
      ],
      "additionalProperties": false,
      "properties": {
        "id": {
          "type": "string",
          "pattern": "^[A-Za-z0-9._-]{1,40}$"
        },
        "title": {
          "type": "string",
          "minLength": 3,
          "maxLength": 120,
          "pattern": "^[\\p{L}\\p{N} .,:()/_-]+$"
        },
        "entryType": {
          "enum": [
            "feature",
            "change",
            "defect",
            "standard",
            "debt",
            "migration-wave",
            "audit-remediation",
            "decommission",
            "experiment",
            "problem"
          ]
        },
        "owner": {
          "type": "string",
          "pattern": "^(h:)?[a-z][a-z0-9-]{1,40}$"
        },
        "due": {
          "type": "string",
          "pattern": "^\\d{4}-\\d{2}-\\d{2}$"
        },
        "changeClassHint": {
          "enum": [
            "standard",
            "normal",
            "emergency"
          ]
        }
      }
    }
  }
}
